[
  {
    "_id": "review:v1:b3a24230cad9cf231ec6d3db",
    "at": "2026-09-26T00:00:00Z",
    "reason": "Unlocated by location-review-v1: no_candidate_passed_type_geography_operator_voltage_review.",
    "record_id": "location:v1:7a81a216365da414c25ddb03",
    "reviewer": "f09-deterministic-rules-v1",
    "verdict": "unresolved"
  },
  {
    "_id": "review:v1:649c0367c6a5661ce19d436d",
    "at": "2026-09-26T00:00:00Z",
    "reason": "Medium by location-review-v1: exact normalized-name match to way/229116275; state evidence home_state_only; operator evidence match; voltage evidence match; coordinate method overpass_bbox_center; limitations project_area_unverified.",
    "record_id": "location:v1:2fe7c9b920f3e61a3fb765f2",
    "reviewer": "f09-deterministic-rules-v1",
    "verdict": "accepted_by_f09_rules"
  },
  {
    "_id": "review:v1:3e541474e6e95ee521bf79af",
    "at": "2026-09-26T00:00:00Z",
    "reason": "Unlocated by location-review-v1: no_named_osm_candidate.",
    "record_id": "location:v1:0a88600e53c68cd751f45fa6",
    "reviewer": "f09-deterministic-rules-v1",
    "verdict": "unresolved"
  },
  {
    "_id": "review:v1:ff66238af7bc7272d53bc13b",
    "at": "2026-09-26T00:00:00Z",
    "reason": "Unlocated by location-review-v1: no_candidate_passed_type_geography_operator_voltage_review.",
    "record_id": "location:v1:1cc41fa7c7cf69457794ba4e",
    "reviewer": "f09-deterministic-rules-v1",
    "verdict": "unresolved"
  },
  {
    "_id": "review:v1:82827507f7487a89af8e4b8e",
    "at": "2026-09-26T00:00:00Z",
    "reason": "Unlocated by location-review-v1: no_candidate_passed_type_geography_operator_voltage_review.",
    "record_id": "location:v1:29a6b5b1287e9d465cdabe1d",
    "reviewer": "f09-deterministic-rules-v1",
    "verdict": "unresolved"
  },
  {
    "_id": "review:v1:9250e7bf562c685f5a9afdc5",
    "at": "2026-09-26T00:00:00Z",
    "reason": "Medium by location-review-v1: exact normalized-name match to way/185032900; state evidence home_state_only; operator evidence match; voltage evidence match; coordinate method overpass_bbox_center; limitations project_area_unverified.",
    "record_id": "location:v1:0e366c65ad5ebd551bd15ce7",
    "reviewer": "f09-deterministic-rules-v1",
    "verdict": "accepted_by_f09_rules"
  },
  {
    "_id": "review:v1:82abb310fe58adf856e40d2d",
    "at": "2026-09-26T00:00:00Z",
    "reason": "Unlocated by location-review-v1: no_named_osm_candidate.",
    "record_id": "location:v1:3ba00cf55f689ad6f28febff",
    "reviewer": "f09-deterministic-rules-v1",
    "verdict": "unresolved"
  },
  {
    "_id": "review:v1:b349191a310ecb963eb67d01",
    "at": "2026-09-26T00:00:00Z",
    "reason": "Unlocated by location-review-v1: no_named_osm_candidate.",
    "record_id": "location:v1:098b8aafbdb5baa991bf8746",
    "reviewer": "f09-deterministic-rules-v1",
    "verdict": "unresolved"
  },
  {
    "_id": "review:v1:4bf16bc295c9e043e06510be",
    "at": "2026-09-26T00:00:00Z",
    "reason": "Medium by location-review-v1: exact normalized-name match to way/185380597; state evidence home_state_only; operator evidence missing; voltage evidence match; coordinate method overpass_bbox_center; limitations project_area_unverified, operator_missing.",
    "record_id": "location:v1:3994702bfb7711c00894935b",
    "reviewer": "f09-deterministic-rules-v1",
    "verdict": "accepted_by_f09_rules"
  },
  {
    "_id": "review:v1:986c9d24d7b74094042a4e65",
    "at": "2026-09-26T00:00:00Z",
    "reason": "Unlocated by location-review-v1: no_named_osm_candidate.",
    "record_id": "location:v1:06760eacb40e3a375d35de68",
    "reviewer": "f09-deterministic-rules-v1",
    "verdict": "unresolved"
  },
  {
    "_id": "review:v1:3ed9f8cc550e8a78794aa371",
    "at": "2026-09-26T00:00:00Z",
    "reason": "Unlocated by location-review-v1: no_candidate_passed_type_geography_operator_voltage_review.",
    "record_id": "location:v1:11bbaa914e3b1404f9ac5bf1",
    "reviewer": "f09-deterministic-rules-v1",
    "verdict": "unresolved"
  },
  {
    "_id": "review:v1:311d983b3839aa4a4bfabbce",
    "at": "2026-09-26T00:00:00Z",
    "reason": "Medium by location-review-v1: exact normalized-name match to way/185330726; state evidence home_state_only; operator evidence missing; voltage evidence match; coordinate method overpass_bbox_center; limitations project_area_unverified, operator_missing.",
    "record_id": "location:v1:4efcf1c399c5417eaf34fb97",
    "reviewer": "f09-deterministic-rules-v1",
    "verdict": "accepted_by_f09_rules"
  },
  {
    "_id": "review:v1:2f020d7c3fdf30538507004f",
    "at": "2026-09-26T00:00:00Z",
    "reason": "Unlocated by location-review-v1: no_named_osm_candidate.",
    "record_id": "location:v1:d2954d2c7aa3bd09a961227d",
    "reviewer": "f09-deterministic-rules-v1",
    "verdict": "unresolved"
  },
  {
    "_id": "review:v1:aba722f55284bb3493bd92b2",
    "at": "2026-09-26T00:00:00Z",
    "reason": "Unlocated by location-review-v1: no_named_osm_candidate.",
    "record_id": "location:v1:14174acffb3a4f15418d72b8",
    "reviewer": "f09-deterministic-rules-v1",
    "verdict": "unresolved"
  },
  {
    "_id": "review:v1:05321fbffa9760c51a261b86",
    "at": "2026-09-26T00:00:00Z",
    "reason": "Medium by location-review-v1: exact normalized-name match to way/185197506; state evidence home_state_only; operator evidence missing; voltage evidence match; coordinate method overpass_bbox_center; limitations project_area_unverified, operator_missing.",
    "record_id": "location:v1:3b1f772d5b45618a4790599b",
    "reviewer": "f09-deterministic-rules-v1",
    "verdict": "accepted_by_f09_rules"
  },
  {
    "_id": "review:v1:b19f88087e53f8fc03a17343",
    "at": "2026-09-26T00:00:00Z",
    "reason": "Unlocated by location-review-v1: no_named_osm_candidate.",
    "record_id": "location:v1:a926082916e96e414de43daf",
    "reviewer": "f09-deterministic-rules-v1",
    "verdict": "unresolved"
  },
  {
    "_id": "review:v1:14052e3224041b85b68be94a",
    "at": "2026-09-26T00:00:00Z",
    "reason": "Unlocated by location-review-v1: no_named_osm_candidate.",
    "record_id": "location:v1:62a4550443834b5594a45c35",
    "reviewer": "f09-deterministic-rules-v1",
    "verdict": "unresolved"
  },
  {
    "_id": "review:v1:d12d67d4b1a771ee69626de5",
    "at": "2026-09-26T00:00:00Z",
    "reason": "Unlocated by location-review-v1: source_gate:filed_title_and_description_endpoint_scope_conflict.",
    "record_id": "location:v1:56a608223890ea4a58044c9e",
    "reviewer": "f09-deterministic-rules-v1",
    "verdict": "unresolved"
  },
  {
    "_id": "review:v1:4a0bb8b07b75e9b7fc480cff",
    "at": "2026-09-26T00:00:00Z",
    "reason": "Unlocated by location-review-v1: source_gate:filed_title_and_description_endpoint_scope_conflict.",
    "record_id": "location:v1:3b3e38521c40e947794c61d1",
    "reviewer": "f09-deterministic-rules-v1",
    "verdict": "unresolved"
  },
  {
    "_id": "review:v1:7e464d764bbca6d6fe9d635f",
    "at": "2026-09-26T00:00:00Z",
    "reason": "Medium by location-review-v1: exact normalized-name match to way/229116275; state evidence home_state_only; operator evidence match; voltage evidence match; coordinate method overpass_bbox_center; limitations project_area_unverified.",
    "record_id": "location:v1:8d58673d87c221e9af5bf197",
    "reviewer": "f09-deterministic-rules-v1",
    "verdict": "accepted_by_f09_rules"
  },
  {
    "_id": "review:v1:10af1486a75cf4b1bd310f93",
    "at": "2026-09-26T00:00:00Z",
    "reason": "Unlocated by location-review-v1: no_candidate_passed_type_geography_operator_voltage_review.",
    "record_id": "location:v1:35bcfe367b31dc13513992c2",
    "reviewer": "f09-deterministic-rules-v1",
    "verdict": "unresolved"
  },
  {
    "_id": "review:v1:150aec1be0ce28065717dcd3",
    "at": "2026-09-26T00:00:00Z",
    "reason": "Medium by location-review-v1: exact normalized-name match to way/185317032; state evidence home_state_only; operator evidence match; voltage evidence match; coordinate method overpass_bbox_center; limitations project_area_unverified.",
    "record_id": "location:v1:fd8f385dc643a022b27c16c3",
    "reviewer": "f09-deterministic-rules-v1",
    "verdict": "accepted_by_f09_rules"
  },
  {
    "_id": "review:v1:6328d25bb6666d4c5e99679b",
    "at": "2026-09-26T00:00:00Z",
    "reason": "Unlocated by location-review-v1: no_named_osm_candidate.",
    "record_id": "location:v1:4c9f38c539ef118850864b94",
    "reviewer": "f09-deterministic-rules-v1",
    "verdict": "unresolved"
  },
  {
    "_id": "review:v1:743eea30728415a906030b67",
    "at": "2026-09-26T00:00:00Z",
    "reason": "Medium by location-review-v1: exact normalized-name match to way/184867924; state evidence home_state_only; operator evidence missing; voltage evidence match; coordinate method overpass_bbox_center; limitations project_area_unverified, operator_missing.",
    "record_id": "location:v1:0c16ea47a281ddf7cd89b461",
    "reviewer": "f09-deterministic-rules-v1",
    "verdict": "accepted_by_f09_rules"
  },
  {
    "_id": "review:v1:e7553504232e70190797edbe",
    "at": "2026-09-26T00:00:00Z",
    "reason": "Unlocated by location-review-v1: no_candidate_passed_type_geography_operator_voltage_review.",
    "record_id": "location:v1:f5ca7b301cfe32c42da600d1",
    "reviewer": "f09-deterministic-rules-v1",
    "verdict": "unresolved"
  },
  {
    "_id": "review:v1:dfde90f5ae3cb47e6176853e",
    "at": "2026-09-26T00:00:00Z",
    "reason": "Unlocated by location-review-v1: no_named_osm_candidate.",
    "record_id": "location:v1:ba543427a2f7470d79d5c03b",
    "reviewer": "f09-deterministic-rules-v1",
    "verdict": "unresolved"
  },
  {
    "_id": "review:v1:75a428e93239315d523d11e2",
    "at": "2026-09-26T00:00:00Z",
    "reason": "Unlocated by location-review-v1: no_named_osm_candidate.",
    "record_id": "location:v1:5ca9d25658102a8e90591381",
    "reviewer": "f09-deterministic-rules-v1",
    "verdict": "unresolved"
  },
  {
    "_id": "review:v1:e6e922171da7d6887eeabb3b",
    "at": "2026-09-26T00:00:00Z",